path,type,required,array,enum,format,description,mii_module,mii_profile,fhir_element,transform,status,notes
case.diagnosisRd.diagnoses[].code,string,yes,yes,,,Symbol in syntax defined by the system,Diagnose,Condition,Condition.code.coding.code,ORPHAcode / Alpha-ID-SE / ICD-10-GM / OMIM,DRAFT,
case.diagnosisRd.diagnoses[].display,string,no,yes,,,Representation defined by the system,Diagnose,Condition,Condition.code.coding.display,ORPHAcode / Alpha-ID-SE / ICD-10-GM / OMIM,DRAFT,
case.diagnosisRd.diagnoses[].system,string,yes,yes,,uri,Identity of the terminology system,Diagnose,Condition,Condition.code.coding.system,ORPHAcode / Alpha-ID-SE / ICD-10-GM / OMIM,DRAFT,
case.diagnosisRd.diagnoses[].version,string,yes,yes,,,Version of the system - if relevant,Diagnose,Condition,Condition.code.coding.version,ORPHAcode / Alpha-ID-SE / ICD-10-GM / OMIM,DRAFT,
case.diagnosisRd.diagnosisGmfcs,string,no,no,"I, II, III, IV, V",,"Age-appropriate information, empty if not applicable",,Observation,Observation.valueCodeableConcept,GMFCS functional score (base FHIR Observation),DRAFT,
case.diagnosisRd.diagnosticAssessment,string,yes,no,"noGeneticDiagnosis, suspectedGeneticDiagnosis, furtherGeneticDiagnosticRecommended, confirmedGeneticDiagnosis, partialGeneticDiagnosis",,Assessment of genetic diagnostics,Diagnose,Condition,Condition,see diagnosisRd.* sub-rules,DRAFT,
case.diagnosisRd.diagnosticExtent,string,yes,no,"singleGenome, duoGenome, trioGenome",,Diagnostics recommendation,MolGen,ServiceRequest (study design),ServiceRequest.code,single/duo/trio genomic testing metadata,DRAFT,
case.diagnosisRd.libraryType,string,yes,no,"panel, wes, wgs, wgs_lr, none",,"Art der Sequenzierung oder none, falls keine Sequenzierung indiziert",MolGen,ServiceRequest / DiagnosticReport (method),ServiceRequest.code,sequencing type; not a diagnosis,DRAFT,
case.diagnosisRd.molecularBoardDecisionDate,string,yes,no,,date,Case conference date,Diagnose,Condition,Condition,see diagnosisRd.* sub-rules,DRAFT,
case.diagnosisRd.noMatchingCodeExists,boolean,no,no,,,Indicates whether a matching code exists.,Diagnose,Condition,Condition,see diagnosisRd.* sub-rules,DRAFT,
case.diagnosisRd.phenotypes[].code,string,yes,yes,,,Symbol in syntax defined by the system,MolGen,Observation (Phaenotyp HPO),Observation.valueCodeableConcept.coding.code,HPO term,DRAFT,
case.diagnosisRd.phenotypes[].display,string,no,yes,,,Representation defined by the system,MolGen,Observation (Phaenotyp HPO),Observation.valueCodeableConcept.coding.display,HPO term,DRAFT,
case.diagnosisRd.phenotypes[].system,string,no,yes,,uri,Identity of the terminology system,MolGen,Observation (Phaenotyp HPO),Observation.valueCodeableConcept.coding.system,HPO term,DRAFT,
case.diagnosisRd.phenotypes[].text,string,no,yes,,,Clinical description of the phenotype,MolGen,Observation (Phaenotyp HPO),Observation.valueCodeableConcept.text,HPO term,DRAFT,
case.diagnosisRd.phenotypes[].version,string,yes,yes,,,Version of the system - if relevant,MolGen,Observation (Phaenotyp HPO),Observation.valueCodeableConcept.coding.version,HPO term,DRAFT,
case.diagnosisRd.symptomOnsetDate,string,yes,no,,,Start of symptoms,Diagnose,Condition,Condition,see diagnosisRd.* sub-rules,DRAFT,
case.priorRds[].diagnosticDate,string,no,yes,,date,Date of diagnostics,Fall,Encounter,Encounter,ZSE contact / hospitalization utilization data,DRAFT,
case.priorRds[].diagnosticResult,string,yes,yes,"phenotypeNotCompletelyClarified, structuralVariantWithUnclearBreakpoint, unclearVariantInGeneticDisease, noPathogenicVariantDetected, other",,Result of diagnostics,Fall,Encounter,Encounter,ZSE contact / hospitalization utilization data,DRAFT,
case.priorRds[].genomicStudyType,string,yes,yes,"single, duo, trio",,,Fall,Encounter,Encounter,ZSE contact / hospitalization utilization data,DRAFT,
case.priorRds[].genomicTestType,string,yes,yes,"exome, genomeLongRead, genomeShortRead, panel, single, array, karyotyping, other, none",,Type of diagnostics,Fall,Encounter,Encounter,ZSE contact / hospitalization utilization data,DRAFT,
case.priorRds[].hospitalizationDuration,string,yes,yes,"none, upToFive, upToFifteen, upToFifty, moreThanFifty, unknown",,Estimated duration of inpatient case-relevant pre-therapy in days,Fall,Encounter,Encounter,ZSE contact / hospitalization utilization data,DRAFT,
case.priorRds[].hospitalizationPeriods,string,yes,yes,"none, upToFive, upToTen, upToFifteen, moreThanFifteen, unknown",,Number of inpatient treatments in the last five years,Fall,Encounter,Encounter,ZSE contact / hospitalization utilization data,DRAFT,
case.priorRds[].zseContactDate,string,yes,yes,,,Month and year of first contact with a specialized center for rare diseases,Fall,Encounter,Encounter,ZSE contact / hospitalization utilization data,DRAFT,
followUp.followUpRds[].deathDate,string,no,yes,,,Month and year of death in YYYY-MM format.,,Observation / Condition,Observation,RD follow-up — NOT MII Onkologie Verlauf,DRAFT,
followUp.followUpRds[].diagnosisEstablished,boolean,yes,yes,,,,,Observation / Condition,Observation,RD follow-up — NOT MII Onkologie Verlauf,DRAFT,
followUp.followUpRds[].diseaseProgression,string,no,yes,,,Case-relevant supplementary data on the progression of the disease.,,Observation / Condition,Observation,RD follow-up — NOT MII Onkologie Verlauf,DRAFT,
followUp.followUpRds[].followUpDate,string,yes,yes,,date,Follow-up date in YYYY-MM-DD format.,,Observation / Condition,Observation,RD follow-up — NOT MII Onkologie Verlauf,DRAFT,
followUp.followUpRds[].gmfcs,string,no,yes,"I, II, III, IV, V",,GMFCS level. Leave empty if not applicable.,,Observation / Condition,Observation,RD follow-up — NOT MII Onkologie Verlauf,DRAFT,
followUp.followUpRds[].phenotypes[].change,string,yes,yes,"newlyAdded, improved, degraded, noLongerObserved, unchanged",,,,Observation / Condition,Observation,RD follow-up — NOT MII Onkologie Verlauf,DRAFT,
followUp.followUpRds[].phenotypes[].code,string,yes,yes,,,Symbol in syntax defined by the system,,Observation / Condition,Observation,RD follow-up — NOT MII Onkologie Verlauf,DRAFT,
followUp.followUpRds[].phenotypes[].display,string,no,yes,,,Representation defined by the system,,Observation / Condition,Observation,RD follow-up — NOT MII Onkologie Verlauf,DRAFT,
followUp.followUpRds[].phenotypes[].system,string,no,yes,,uri,Identity of the terminology system,,Observation / Condition,Observation,RD follow-up — NOT MII Onkologie Verlauf,DRAFT,
followUp.followUpRds[].phenotypes[].text,string,no,yes,,,Clinical description of the phenotype,,Observation / Condition,Observation,RD follow-up — NOT MII Onkologie Verlauf,DRAFT,
followUp.followUpRds[].phenotypes[].version,string,no,yes,,,Version of the system - if relevant,,Observation / Condition,Observation,RD follow-up — NOT MII Onkologie Verlauf,DRAFT,
followUp.followUpRds[].vitalStatus,string,yes,yes,"living, deceased",,Vital status at the last contact.,,Observation / Condition,Observation,RD follow-up — NOT MII Onkologie Verlauf,DRAFT,
metaData.addressAGS,string,yes,no,,,Official municipal code of the patient's residence.,Person,https://www.medizininformatik-initiative.de/fhir/core/modul-person/StructureDefinition/PatientPseudonymisiert,Patient.address:Strassenanschrift.city.extension:gemeindeschluessel,AGS Gemeindeschluessel; ext http://fhir.de/StructureDefinition/destatis/ags mounts on address.CITY (P0: not address.extension); valueCoding system urn:oid:1.2.276.0.76.5.474,MAPPED,[[mii-person-fall]]
metaData.birthDate,string,yes,no,,,Date of birth without the day. Format YYYY-MM,Person,https://www.medizininformatik-initiative.de/fhir/core/modul-person/StructureDefinition/PatientPseudonymisiert,Patient.birthDate,FHIR date; YYYY-MM is valid — do not pad,MAPPED,[[mii-person-fall]]
metaData.coverageType,string,yes,no,"GKV, PKV, BG, SEL, SOZ, GPV, PPV, BEI, SKT, UNK",,Health insurance providers,Fall,http://fhir.de/StructureDefinition/coverage-de-basis,Coverage.type,"-> versicherungsart-de-basis VS; GKV upgrades meta.profile to coverage-de-gkv; SKT->KBV CS, UNK->v3-NullFlavor; guard the 8 valid codes",MAPPED,[[mii-person-fall]]
metaData.decisionToInclude,boolean,yes,no,,,Decision of the multidisciplinary case conference in the field of diagnostics on the inclusion of the insured person in the pilot project,,,,MV board inclusion decision; administrative,NOMAP,
metaData.gender,string,yes,no,"male, female, other, unknown",,,Person,https://www.medizininformatik-initiative.de/fhir/core/modul-person/StructureDefinition/PatientPseudonymisiert,Patient.gender (+ extension:other-amtlich),ConceptMap genomDE->administrative-gender; gender-amtlich-de ext (D/X) when gender=other,MAPPED,[[mii-person-fall]]
metaData.localCaseId,string,no,no,,,A local case identifier of the Leistungserbringer to be able to track multiple submissions referring to the same index patient,Person,https://www.medizininformatik-initiative.de/fhir/core/modul-person/StructureDefinition/PatientPseudonymisiert,Patient.identifier:pid,local case/patient id; type.coding=MR (v2-0203); also links the per-case Encounter,MAPPED,[[mii-person-fall]]
metaData.molecularBoardDecisionDate,string,yes,no,,date,Date of the decision of the multidisciplinary case conference in the field of diagnostics on the inclusion of the insured person in the pilot project,Fall,https://www.medizininformatik-initiative.de/fhir/core/modul-fall/StructureDefinition/KontaktGesundheitseinrichtung,Encounter.period.start,"MTB decision date; seeds per-case Encounter (class=AMB, status=finished); also MedicationRequest.authoredOn",MAPPED,[[mii-person-fall]]
metaData.mvConsent.presentationDate,string,no,no,,date,"Date of delivery. Date (in ISO 8601 format YYYY-MM-DD) on which the Model Project Declaration of Participation was presented to the patient, unless identical to the date of signature",Consent,https://www.medizininformatik-initiative.de/fhir/modul-consent/StructureDefinition/mii-pr-consent-einwilligung,Consent.dateTime,date the MV declaration was presented,MAPPED,[[mii-consent-med-proc]]
metaData.mvConsent.scope[].date,string,yes,yes,,date,Date of signature of the pilot projects consent; in ISO 8601 format YYYY-MM-DD.,Consent,https://www.medizininformatik-initiative.de/fhir/modul-consent/StructureDefinition/mii-pr-consent-einwilligung,Consent.provision.provision.period.start,signature date of this consent scope,MAPPED,[[mii-consent-med-proc]]
metaData.mvConsent.scope[].domain,string,yes,yes,"mvSequencing, reIdentification, caseIdentification",,Scope of consent or revocation.,Consent,https://www.medizininformatik-initiative.de/fhir/modul-consent/StructureDefinition/mii-pr-consent-einwilligung,Consent.provision.provision.code,"domain->broad-consent code: mvSequencing=...24.5.3.8, caseIdentification=...5.3.2, reIdentification=...5.3.6; code.system urn:oid:2.16.840.1.113883.3.1937.777.24.5.3",MAPPED,[[mii-consent-med-proc]]
metaData.mvConsent.scope[].type,string,yes,yes,"permit, deny",,"Consent or refusal to participate and consent, must be indicated for each option listed in the scope of consent.",Consent,https://www.medizininformatik-initiative.de/fhir/modul-consent/StructureDefinition/mii-pr-consent-einwilligung,Consent.provision.provision.type,permit/deny per inner provision,MAPPED,[[mii-consent-med-proc]]
metaData.mvConsent.version,string,yes,no,,,"Version of the declaration of participation. Name and version of the declaration of participation in the MV GenomSeq, e.g.: 'Patient Info TE Consent MVGenomSeq vers01'",Consent,https://www.medizininformatik-initiative.de/fhir/modul-consent/StructureDefinition/mii-pr-consent-einwilligung,Consent.policy.uri,declaration version; policy.uri urn:oid:2.16.840.1.113883.3.1937.777.24.2.2079,MAPPED,[[mii-consent-med-proc]]
metaData.rejectionJustification,string,no,no,"targetedDiagnosticRecommended, probablyPsychosomaticIllness, probablyCommonDisease, probablyNoGeneticCause, otherReason",,Reason for the negative decision,,,,administrative,NOMAP,
metaData.researchConsents[].noScopeJustification,string,no,yes,"patient unable to consent, patient refuses to sign consent, patient did not return consent documents, other patient-related reason, consent information cannot be submitted by LE due to technical reason, consent is not implemented at LE due to organizational issues",,Justification if no scope object is present.,,,,"justification when no scope present; provenance only, no clinical KDS element",NOMAP,[[mii-consent-med-proc]]
metaData.researchConsents[].presentationDate,string,yes,yes,,date,Date of the delivery of the research consent in ISO 8601 format (YYYY-MM-DD),Consent,https://www.medizininformatik-initiative.de/fhir/modul-consent/StructureDefinition/mii-pr-consent-einwilligung,Consent.dateTime,delivery date of the research consent,MAPPED,[[mii-consent-med-proc]]
metaData.researchConsents[].schemaVersion,string,no,yes,2025.0.1,,Schema version of de.medizininformatikinitiative.kerndatensatz.consent,,,,"consent KDS package version (2025.0.1); metadata, not a mapped element",NOMAP,[[mii-consent-med-proc]]
metaData.researchConsents[].scope,object,no,yes,,,Scope of the research consent in JSON format following the MII IG Consent v2025 FHIR schema. See 'https://www.medizininformatik-initiative.de/Kerndatensatz/KDS_Consent_V2025/MII-IG-Modul-Consent.html' and 'https://packages2.fhir.org/packages/de.medizininformatikinitiative.kerndatensatz.consent'.,Consent,https://www.medizininformatik-initiative.de/fhir/modul-consent/StructureDefinition/mii-pr-consent-einwilligung,(whole Consent resource),"embedded MII Consent — lift VERBATIM as additional Bundle.entry Consent (~27 provisions); passthrough, not field-mapped",MAPPED,[[mii-consent-med-proc]]
metaData.submission.clinicalDataNodeId,string,yes,no,,,"Id of the clinical data node, format KDKXXXnnn 9-digit assigned by BfArM",,,,"submission/transport provenance -> Bundle/Provenance, not KDS clinical",NOMAP,
metaData.submission.date,string,yes,no,,date,Date of submission in ISO 8601 format YYYY-MM-DD,,,,"submission/transport provenance -> Bundle/Provenance, not KDS clinical",NOMAP,
metaData.submission.diseaseType,string,yes,no,"oncological, rare, hereditary",,"Type of disease (must be oncological or hereditary for Oncology object, rare for RareDiseasesObject)",,,,"submission/transport provenance -> Bundle/Provenance, not KDS clinical",NOMAP,
metaData.submission.genomicDataCenterId,string,no,no,,,"Id of the genomic data center, format GRZXXXnnn 9-digit assigned by BfArM. Not required in cases where diagnosisOd.libraryType = none.",,,,"submission/transport provenance -> Bundle/Provenance, not KDS clinical",NOMAP,
metaData.submission.submitterId,string,yes,no,,,LE ID as specified by the BfArM or RVO,,,,"submission/transport provenance -> Bundle/Provenance, not KDS clinical",NOMAP,
metaData.submission.type,string,yes,no,"initial, followup, addition, correction, test",,"The options are: 'initial' for first submission, 'followup' is for followup submissions, 'addition' for additional submission, 'correction' for correction, 'test' is for technical testing of submissions",,,,"submission/transport provenance -> Bundle/Provenance, not KDS clinical",NOMAP,
metaData.tanC,string,yes,no,,,Transaction number VNk,Person,https://www.medizininformatik-initiative.de/fhir/core/modul-person/StructureDefinition/PatientPseudonymisiert,Patient.identifier:PseudonymisierterIdentifier,tanC pseudonym; type.coding=PSEUDED (v3-ObservationValue) + assigner.identifier; KDK-stream pseudonym — never co-mingle with tanG,MAPPED,[[mii-person-fall]]
molecular.copyNumberVariants[].acmgClass,string,no,yes,"1, 2, 3, 4, 5",,ACMG class.,MolGen,Observation (CopyNumberVariant),Observation,CNV; ACMG criteria; VERIFY profile,DRAFT,
molecular.copyNumberVariants[].acmgCriteria[].modifier,string,no,yes,"pvs, ps, pm, pp, ba, bs, bp, bm",,,MolGen,Observation (CopyNumberVariant),Observation,CNV; ACMG criteria; VERIFY profile,DRAFT,
molecular.copyNumberVariants[].acmgCriteria[].value,string,yes,yes,"PVS1, PS1, PS2, PS3, PS4, PM1, PM2, PM3, PM4, PM5, PM6, PP1, PP2, PP3, PP4, PP5, BA1, BS1, BS2, BS3, BS4, BP1, BP2, BP3, BP4, BP5, BP6, BP7",,,MolGen,Observation (CopyNumberVariant),Observation,CNV; ACMG criteria; VERIFY profile,DRAFT,
molecular.copyNumberVariants[].cdnaChange,string,no,yes,,,cDNA change (HGVS).,MolGen,Observation (CopyNumberVariant),Observation,CNV; ACMG criteria; VERIFY profile,DRAFT,
molecular.copyNumberVariants[].chromosome,string,yes,yes,"1, 2, 3, 4, 5, 6, 7, 8, 9, 10, 11, 12, 13, 14, 15, 16, 17, 18, 19, 20, 21, 22, X, Y, MT",,,MolGen,https://www.medizininformatik-initiative.de/fhir/ext/modul-molgen/StructureDefinition/mii-pr-molgen-kopienzahlvariante,Observation.component:chromosome.valueCodeableConcept,LOINC 48000-4,MAPPED,[[mii-molgen-biobank]]
molecular.copyNumberVariants[].diagnosticSignificance,string,no,yes,"primary, incidental, candidate",,Significance for case.,MolGen,Observation (CopyNumberVariant),Observation,CNV; ACMG criteria; VERIFY profile,DRAFT,
molecular.copyNumberVariants[].endPosition,integer,yes,yes,,,GRCh38 coordinate VCF-style.,MolGen,https://www.medizininformatik-initiative.de/fhir/ext/modul-molgen/StructureDefinition/mii-pr-molgen-kopienzahlvariante,Observation.component:exact-start-end.valueRange.high,LOINC 81254-5,MAPPED,[[mii-molgen-biobank]]
molecular.copyNumberVariants[].externalId,string,no,yes,,,ClinVar variant ID.,MolGen,Observation (CopyNumberVariant),Observation,CNV; ACMG criteria; VERIFY profile,DRAFT,
molecular.copyNumberVariants[].gdnaChange,string,no,yes,,,gDNA change (HGVS).,MolGen,Observation (CopyNumberVariant),Observation,CNV; ACMG criteria; VERIFY profile,DRAFT,
molecular.copyNumberVariants[].genes[].code,string,no,yes,,,HGNC:ID,MolGen,Observation (CopyNumberVariant),Observation,CNV; ACMG criteria; VERIFY profile,DRAFT,
molecular.copyNumberVariants[].identifier,string,yes,yes,,,,MolGen,https://www.medizininformatik-initiative.de/fhir/ext/modul-molgen/StructureDefinition/mii-pr-molgen-kopienzahlvariante,Observation.identifier,CNV id,MAPPED,[[mii-molgen-biobank]]
molecular.copyNumberVariants[].localization[].code,string,no,yes,"codingRegion, splicingRegion, regulatoryRegion, intronic, intergenic",,Gene localization,MolGen,Observation (CopyNumberVariant),Observation,CNV; ACMG criteria; VERIFY profile,DRAFT,
molecular.copyNumberVariants[].modeOfInheritance,string,no,yes,"dominant, recessive, XLinked, mitochondrial, unclear",,,MolGen,Observation (CopyNumberVariant),Observation,CNV; ACMG criteria; VERIFY profile,DRAFT,
molecular.copyNumberVariants[].proteinChange,string,no,yes,,,Protein change (HGVS).,MolGen,Observation (CopyNumberVariant),Observation,CNV; ACMG criteria; VERIFY profile,DRAFT,
molecular.copyNumberVariants[].publications[],string,no,yes,,,,MolGen,Observation (CopyNumberVariant),Observation,CNV; ACMG criteria; VERIFY profile,DRAFT,
molecular.copyNumberVariants[].segregationAnalysis,string,no,yes,"notPerformed, deNovo, fromFather, fromMother, fromMotherAndFather",,Segregation analysis.,MolGen,Observation (CopyNumberVariant),Observation,CNV; ACMG criteria; VERIFY profile,DRAFT,
molecular.copyNumberVariants[].startPosition,integer,yes,yes,,,GRCh38 coordinate VCF-style.,MolGen,https://www.medizininformatik-initiative.de/fhir/ext/modul-molgen/StructureDefinition/mii-pr-molgen-kopienzahlvariante,Observation.component:exact-start-end.valueRange.low,LOINC 81254-5,MAPPED,[[mii-molgen-biobank]]
molecular.copyNumberVariants[].type,string,yes,yes,"gain, loss",,,MolGen,Observation (CopyNumberVariant),Observation,CNV; ACMG criteria; VERIFY profile,DRAFT,
molecular.copyNumberVariants[].zygosity,string,no,yes,"heterozygous, homozygous, compHet, hemi, homoplasmic, heteroplasmic",,Zygosity.,MolGen,Observation (CopyNumberVariant),Observation,CNV; ACMG criteria; VERIFY profile,DRAFT,
molecular.smallVariants[].acmgClass,string,no,yes,"1, 2, 3, 4, 5",,ACMG class.,MolGen,Observation (SmallVariant),Observation,"Genomics Reporting variant; ACMG criteria, HGNC gene; VERIFY profile+HGNC version",DRAFT,
molecular.smallVariants[].acmgCriteria[].modifier,string,no,yes,"pvs, ps, pm, pp, ba, bs, bp, bm",,,MolGen,Observation (SmallVariant),Observation,"Genomics Reporting variant; ACMG criteria, HGNC gene; VERIFY profile+HGNC version",DRAFT,
molecular.smallVariants[].acmgCriteria[].value,string,yes,yes,"PVS1, PS1, PS2, PS3, PS4, PM1, PM2, PM3, PM4, PM5, PM6, PP1, PP2, PP3, PP4, PP5, BA1, BS1, BS2, BS3, BS4, BP1, BP2, BP3, BP4, BP5, BP6, BP7",,,MolGen,Observation (SmallVariant),Observation,"Genomics Reporting variant; ACMG criteria, HGNC gene; VERIFY profile+HGNC version",DRAFT,
molecular.smallVariants[].alt,string,yes,yes,,,alt/observed sequence VCF-style.,MolGen,https://www.medizininformatik-initiative.de/fhir/ext/modul-molgen/StructureDefinition/mii-pr-molgen-variante,Observation.component:genomic-alt-allele.valueString,LOINC 69551-0,MAPPED,[[mii-molgen-biobank]]
molecular.smallVariants[].cdnaChange,string,no,yes,,,cDNA change (HGVS).,MolGen,Observation (SmallVariant),Observation,"Genomics Reporting variant; ACMG criteria, HGNC gene; VERIFY profile+HGNC version",DRAFT,
molecular.smallVariants[].chromosome,string,yes,yes,"1, 2, 3, 4, 5, 6, 7, 8, 9, 10, 11, 12, 13, 14, 15, 16, 17, 18, 19, 20, 21, 22, X, Y, MT",,,MolGen,https://www.medizininformatik-initiative.de/fhir/ext/modul-molgen/StructureDefinition/mii-pr-molgen-variante,Observation.component:chromosome.valueCodeableConcept,LOINC 48000-4; LA codes LL2938-0 (chr1 LA21254-0 ..),MAPPED,[[mii-molgen-biobank]]
molecular.smallVariants[].diagnosticSignificance,string,no,yes,"primary, incidental, candidate",,Significance for case.,MolGen,Observation (SmallVariant),Observation,"Genomics Reporting variant; ACMG criteria, HGNC gene; VERIFY profile+HGNC version",DRAFT,
molecular.smallVariants[].endPosition,integer,yes,yes,,,End coordinate in GRCh38 VCF-style.,MolGen,https://www.medizininformatik-initiative.de/fhir/ext/modul-molgen/StructureDefinition/mii-pr-molgen-variante,Observation.component:exact-start-end.valueRange.high,LOINC 81254-5 Range,MAPPED,[[mii-molgen-biobank]]
molecular.smallVariants[].externalId,string,no,yes,,,ClinVar variant ID.,MolGen,Observation (SmallVariant),Observation,"Genomics Reporting variant; ACMG criteria, HGNC gene; VERIFY profile+HGNC version",DRAFT,
molecular.smallVariants[].gdnaChange,string,no,yes,,,gDNA change (HGVS).,MolGen,Observation (SmallVariant),Observation,"Genomics Reporting variant; ACMG criteria, HGNC gene; VERIFY profile+HGNC version",DRAFT,
molecular.smallVariants[].genes[].code,string,no,yes,,,HGNC:ID,MolGen,Observation (SmallVariant),Observation,"Genomics Reporting variant; ACMG criteria, HGNC gene; VERIFY profile+HGNC version",DRAFT,
molecular.smallVariants[].identifier,string,yes,yes,,,,MolGen,https://www.medizininformatik-initiative.de/fhir/ext/modul-molgen/StructureDefinition/mii-pr-molgen-variante,Observation.identifier,variant id,MAPPED,[[mii-molgen-biobank]]
molecular.smallVariants[].localization[].code,string,no,yes,"codingRegion, splicingRegion, regulatoryRegion, intronic, intergenic",,Gene localization,MolGen,Observation (SmallVariant),Observation,"Genomics Reporting variant; ACMG criteria, HGNC gene; VERIFY profile+HGNC version",DRAFT,
molecular.smallVariants[].modeOfInheritance,string,no,yes,"dominant, recessive, XLinked, mitochondrial, unclear",,,MolGen,Observation (SmallVariant),Observation,"Genomics Reporting variant; ACMG criteria, HGNC gene; VERIFY profile+HGNC version",DRAFT,
molecular.smallVariants[].proteinChange,string,no,yes,,,Protein change (HGVS).,MolGen,https://www.medizininformatik-initiative.de/fhir/ext/modul-molgen/StructureDefinition/mii-pr-molgen-variante,Observation.component:amino-acid-change.valueCodeableConcept,pHGVS; LOINC 48005-3,MAPPED,[[mii-molgen-biobank]]
molecular.smallVariants[].publications[],string,no,yes,,,,MolGen,Observation (SmallVariant),Observation,"Genomics Reporting variant; ACMG criteria, HGNC gene; VERIFY profile+HGNC version",DRAFT,
molecular.smallVariants[].ref,string,yes,yes,,,ref sequence VCF-style.,MolGen,https://www.medizininformatik-initiative.de/fhir/ext/modul-molgen/StructureDefinition/mii-pr-molgen-variante,Observation.component:genomic-ref-allele.valueString,LOINC 69547-8,MAPPED,[[mii-molgen-biobank]]
molecular.smallVariants[].segregationAnalysis,string,no,yes,"notPerformed, deNovo, fromFather, fromMother, fromMotherAndFather",,Segregation analysis.,MolGen,Observation (SmallVariant),Observation,"Genomics Reporting variant; ACMG criteria, HGNC gene; VERIFY profile+HGNC version",DRAFT,
molecular.smallVariants[].startPosition,integer,yes,yes,,,Start coordinate in GRCh38 VCF-style.,MolGen,https://www.medizininformatik-initiative.de/fhir/ext/modul-molgen/StructureDefinition/mii-pr-molgen-variante,Observation.component:exact-start-end.valueRange.low,LOINC 81254-5 Range,MAPPED,[[mii-molgen-biobank]]
molecular.smallVariants[].zygosity,string,no,yes,"heterozygous, homozygous, compHet, hemi, homoplasmic, heteroplasmic",,Zygosity.,MolGen,Observation (SmallVariant),Observation,"Genomics Reporting variant; ACMG criteria, HGNC gene; VERIFY profile+HGNC version",DRAFT,
molecular.structuralVariants[].acmgClass,string,no,yes,"1, 2, 3, 4, 5",,ACMG class.,MolGen,Observation (StructuralVariant),Observation,SV; ACMG criteria; VERIFY profile,DRAFT,
molecular.structuralVariants[].acmgCriteria[].modifier,string,no,yes,"pvs, ps, pm, pp, ba, bs, bp, bm",,,MolGen,Observation (StructuralVariant),Observation,SV; ACMG criteria; VERIFY profile,DRAFT,
molecular.structuralVariants[].acmgCriteria[].value,string,yes,yes,"PVS1, PS1, PS2, PS3, PS4, PM1, PM2, PM3, PM4, PM5, PM6, PP1, PP2, PP3, PP4, PP5, BA1, BS1, BS2, BS3, BS4, BP1, BP2, BP3, BP4, BP5, BP6, BP7",,,MolGen,Observation (StructuralVariant),Observation,SV; ACMG criteria; VERIFY profile,DRAFT,
